{
  "component_classifier_v1_digest": "sha256:22d78882a2dace9ceb640b74b2a5dca2f2a8cc05861720f5ab25c5c9ac86c445",
  "frozen_classifier_digest": "sha256:1cf8c021b066ceeb364e968add074d263cb28d63db421fdc40620e9904d0ddbc",
  "negative_tests_pass": "sha256:1bd86de7b636bf57ead1a1ecfd00c9b75379ae49d1458a41bd7c22987d6f92f6",
  "predecessor_heads": {
    "program_dag_projection_merge": "4915be30c4214f8a3d591b7f9259169cdb65c75b",
    "wp3_system_unit_merge": "e514f1e761ab9c1965a133f1f113e2e7ccd854df"
  },
  "production_authority_flags": {
    "nine_authorities_false": true,
    "production_apply_performed": false,
    "running_attested": false
  },
  "program_id": "AIML-LONG-LIVED-LANDING-V2",
  "s2_0_driver_reachability_proof": {
    "adapter_id": "pg_observer_bootstrap_adapter_v1",
    "driver_protocol_present": true,
    "production_success_status": "APPLIED",
    "registry_status": "AUTHORITY_LOCKED_PRODUCTION_CAPABLE",
    "unconditional_production_pending_removed": true
  },
  "schema_version": "s2_4_source_admission_receipt_v1",
  "self_digest": "sha256:adeb39b7f70e51c20db6a5175dc1b9c37d619597a2f2b28c7a2d37738781163b",
  "source_head": "f66fe0790ee13c098ad99bbdea3c9001f76328a4",
  "three_head_projection_digest": "sha256:0ce1503f9a7643420e077db10db9b643712dce7f096a5ab8a2ad1fd07598640b",
  "trust_pin_digests": {
    "independent_test_blob": "901300a8cd6e1760ea00d908c310bd42ca531c52",
    "independent_test_sha256": "sha256:6b3e775dd05159681366f8046caebc816dd89025de422412d319d45ca49370b7",
    "operator_fingerprint": "SHA256:uGJ9veN7PoE6BBgfsSP2aiMndrwgbt7o/7/YfdzNzCQ",
    "trusted_host_module_blob": "8b494cd2678ee70e4afc4efe62561a0ef0f2169e",
    "trusted_host_module_sha256": "sha256:00b568a577afbe8d29bb2ab5b33da8487c6fdda1c73f0c7fc63b5b11254d09eb"
  },
  "wave": "W0",
  "work_package": "WP4",
  "wp3_system_unit_alignment_proof": {
    "database": "trading_ai",
    "lifecycle_owner": "host_system_manager",
    "role": "aiml_engine_scanner",
    "systemctl_user_absent": true
  }
}
